{
  "$schema": "https://json-schema.org/draft/2020-12/schema",
  "$id": "https://schemas.kumwe.org/studio/v1/provenance.schema.json",
  "title": "Studio artifact provenance record",
  "type": "object",
  "additionalProperties": false,
  "required": ["contractVersion", "kind", "artifact", "chain"],
  "properties": {
    "contractVersion": { "$ref": "common.schema.json#/$defs/contractVersion" },
    "kind": { "const": "provenance" },
    "artifact": {
      "type": "object",
      "additionalProperties": false,
      "required": ["id", "revision"],
      "properties": {
        "id": { "$ref": "common.schema.json#/$defs/stableId" },
        "revision": { "$ref": "common.schema.json#/$defs/revision" }
      }
    },
    "chain": {
      "type": "array",
      "minItems": 1,
      "maxItems": 10000,
      "items": {
        "type": "object",
        "additionalProperties": false,
        "required": ["origin", "toRevision", "recordedAt", "actor"],
        "properties": {
          "origin": {
            "enum": ["authoring", "import", "migration", "pattern", "plugin", "system"]
          },
          "fromRevision": { "$ref": "common.schema.json#/$defs/revision" },
          "toRevision": { "$ref": "common.schema.json#/$defs/revision" },
          "recordedAt": { "$ref": "common.schema.json#/$defs/rfc3339Instant" },
          "actor": {
            "type": "object",
            "additionalProperties": false,
            "required": ["id"],
            "properties": {
              "id": { "$ref": "common.schema.json#/$defs/stableId" },
              "displayName": {
                "type": "string",
                "minLength": 1,
                "maxLength": 200
              }
            }
          },
          "sessionId": { "$ref": "common.schema.json#/$defs/stableId" },
          "commandCount": { "type": "integer", "minimum": 0, "maximum": 100000 },
          "source": { "$ref": "common.schema.json#/$defs/artifactReference" },
          "migrationId": { "$ref": "common.schema.json#/$defs/qualifiedName" }
        }
      }
    },
    "extensions": { "$ref": "common.schema.json#/$defs/extensions" }
  }
}
