{
  "contractVersion": "0.1-draft",
  "kind": "provenance",
  "artifact": {
    "id": "landing.blueprint",
    "revision": "blueprint-r9"
  },
  "chain": [
    {
      "origin": "authoring",
      "fromRevision": "blueprint-r8",
      "toRevision": "blueprint-r9",
      "recordedAt": "2026-08-15T09:30:00Z",
      "actor": { "id": "users/lemuel", "displayName": "Lemuel" },
      "sessionId": "sessions/2f6c1f6d",
      "commandCount": 14
    },
    {
      "origin": "migration",
      "fromRevision": "blueprint-r7",
      "toRevision": "blueprint-r8",
      "recordedAt": "2026-08-14T16:05:12Z",
      "actor": { "id": "users/lemuel", "displayName": "Lemuel" },
      "migrationId": "org.example.migration/rename-text"
    },
    {
      "origin": "pattern",
      "toRevision": "blueprint-r7",
      "recordedAt": "2026-08-14T15:58:41Z",
      "actor": { "id": "users/lemuel", "displayName": "Lemuel" },
      "source": {
        "id": "patterns/hero-with-caption",
        "version": "1.2.0",
        "revision": "pattern-r3"
      }
    }
  ]
}
